Python Algorithms, 2nd Edition explains the Python approach to algorithm analysis and design. Written by Magnus Lie Hetland, author of Beginning Python, this book is sharply focused on classical algorithms, but it also gives a solid understanding of ...# 4054884817# http://s.it-ebooks-api.info/6/python_algorithms_2nd_edition.jpg# 9781484200568# Mastering Basic Algorithms in the Python Language# Python Algorithms, 2nd Edition
Take a smartphone from your pocket, and within a few seconds, you can snap a photo, manipulate it, and share it with the world. You have just achieved mass production of image data. With a computer vision library such as OpenCV, you can analyze and t ...# 2133117169# http://s.it-ebooks-api.info/14/android_application_programming_with_opencv.jpg# 9781849695206# Build Android apps to capture, manipulate, and track objects in 2D and 3D# Android Application Programming with OpenCV
Windows 8 has been described by Microsoft as its &quot;boldest&quot; Windows release ever and the 8.1 update enhances the paradigm further. Beginning Windows 8.1 takes you through the new features and helps you get more out of the familiar to reveal ...# 4120193582# http://s.it-ebooks-api.info/6/beginning_windows_8.1.jpg# 9781430263586# # Beginning Windows 8.1
Thanks to new, inexpensive microcontrollers, robotics has become far more accessible than it was in the past. These microcontrollers provide a whole new set of capabilities to allow even the most inexperienced users to make amazingly complicated proj ...# 661209773# http://s.it-ebooks-api.info/14/beaglebone_robotic_projects.jpg# 9781783559329# Create complex and exciting robotic projects with the BeagleBone Black# BeagleBone Robotic Projects
Computer generated graphics (CGI) are part of the design market. CGI helps digital designers from many industries to have a clear representation of their products before they are produced. To name a few, interior designers, architectural studios, and ...# 2452810425# http://s.it-ebooks-api.info/14/building_3d_models_with_modo_701.jpg# 9781849692465# Learn the art of next generation 3D content creation with step-by-step instructions from a real-world pro# Building 3D Models with modo 701
In the age of cybernation, Citrix XenApp has emerged as a prolific application virtualization product. This powerful solution enables users or an enterprise to have centrally hosted and managed applications on corporate servers which can be accessed ...# 2147227442# http://s.it-ebooks-api.info/14/citrix_xenapp_6.5_expert_cookbook.jpg# 9781849685221# Over 125 recipes that enable you to configure, administer, and troubleshoot a XenApp infrastructure for effective application virtualization# Citrix XenApp 6.5 Expert Cookbook
C++ is the language behind most of today's computer games. This 96-page C++ Game Development Primer takes you through the accelerated process of writing games for otherwise experienced C++ programmers. After reading this book, you'll have the fundame ...# 296136647# http://s.it-ebooks-api.info/6/c_game_development_primer.jpg# 9781484208151# # C++ Game Development Primer
Scratch is the wildly popular ­educational programming language used by ­millions of first-time learners in classrooms and homes worldwide. By dragging ­together colorful blocks of code, kids can learn computer programming concepts and make cool g ...# 1675272025# http://s.it-ebooks-api.info/15/super_scratch_programming_adventure_2nd_edition.jpg# 9781593275310# Learn to Program by Making Cool Games# Super Scratch Programming Adventure, 2nd Edition
Scratch is a fun, free, beginner-friendly programming environment where you connect blocks of code to build programs. While most famously used to introduce kids to programming, Scratch can make computer science approachable for people of any age. Rat ...# 1353014162# http://s.it-ebooks-api.info/15/learn_to_program_with_scratch.jpg# 9781593275433# A Visual Introduction to Programming with Games, Art, Science, and Math# Learn to Program with Scratch
Network security is not simply about building impenetrable walls — determined attackers will eventually overcome traditional defenses. The most effective computer security strategies integrate network security monitoring (NSM): the collection and a ...# 1413119425# http://s.it-ebooks-api.info/15/the_practice_of_network_security_monitoring.jpg# 9781593275099# Understanding Incident Detection and Response# The Practice of Network Security Monitoring
The design and analysis of efficient data structures has long been recognized as a key component of the Computer Science curriculum. Goodrich and Tomassia's approach to this classic topic is based on the object-oriented paradigm as the framework of c ...# 3328872839# http://s.it-ebooks-api.info/9/data_structures_and_algorithms_in_java_6th_edition.jpg# 9781118771334# International Student Version# Data Structures and Algorithms in Java, 6th Edition
Introducing a NEW addition to our growing library of computer science titles, Algorithm Design and Applications, by Michael T. Goodrich &amp; Roberto Tamassia! Algorithms is a course required for all computer science majors, with a strong focus on th ...# 3956307364# http://s.it-ebooks-api.info/9/algorithm_design_and_applications.jpg# 9781118335918# # Algorithm Design and Applications
ActionScript 3 is a full-fledged programming language, with complete object-oriented capabilities, event handling, sound and video support, drawing capabilities, support for regular expressions, and much more.

Whether you are just starting out on ...# 2037096987# http://s.it-ebooks-api.info/6/foundation_actionscript_3_2nd_edition.jpg# 9781484205853# # Foundation ActionScript 3, 2nd Edition
The Raspberry Pi is deceptively simple. Plug it in, boot it up, and use it as a personal computer, or attach a million gizmos and modules and invent something new and amazing. Either way, what it can actually do is not simple, and you should know exa ...# 3590162959# http://s.it-ebooks-api.info/6/raspberry_pi_hardware_reference.jpg# 9781484208007# # Raspberry Pi Hardware Reference
C Primer Plus is a carefully tested, well-crafted, and complete tutorial on a subject core to programmers and developers. This computer science classic teaches principles of programming, including structured code and top-down design.

Author and ed ...# 1136246725# http://s.it-ebooks-api.info/10/c_primer_plus_6th_edition.jpg# 9780321928429# # C Primer Plus, 6th Edition
Unlike some operating systems, Linux doesn't try to hide the important bits from you—it gives you full control of your computer. But to truly master Linux, you need to understand its internals, like how the system boots, how networking works, and w ...# 991185306# http://s.it-ebooks-api.info/15/how_linux_works_2nd_edition.jpg# 9781593275679# What Every Superuser Should Know# How Linux Works, 2nd Edition
Get the most out of Windows 8.1 for your every day computing tasks, with no jargon. Clear, concise and to the point. This brief book, Everyday Computing With Windows 8.1 provides the essentials of using a desktop or laptop running Windows 8 or 8.1, p ...# 2121163814# http://s.it-ebooks-api.info/6/everyday_computing_with_windows_8.1.jpg# 9781484208069# # Everyday Computing with Windows 8.1
C++ is the workhorse of programming languages and remains one of the most widely used programming languages today. It's cross-platform, multi-functional, and updates are typically open-source. The language itself is object-oriented, offering you the ...# 1828166419# http://s.it-ebooks-api.info/9/c_all-in-one_for_dummies_3rd_edition.jpg# 9781118823781# # C++ All-in-One For Dummies, 3rd Edition
Whether you prefer to snap shots on your smartphone or never leave home without your DSLR, chances are you have way more photos than you ever dreamed possible. With the help of Photoshop Elements 13 All-in-One For Dummies, you can edit those photos a ...# 3834941364# http://s.it-ebooks-api.info/9/photoshop_elements_13_all-in-one_for_dummies.jpg# 9781118998601# # Photoshop Elements 13 All-in-One For Dummies
This book teaches you how to model a nautical scene, complete with boats and water, and then add materials, lighting, and animation. It demystifies the Blender interface and explains what each tool does so that you will be left with a thorough unders ...# 1811524141# http://s.it-ebooks-api.info/14/blender_3d_basics_2nd_edition.jpg# 9781783984909# A quick and easy-to-use guide to create 3D modeling and animation using Blender 2.7# Blender 3D Basics, 2nd Edition
Raspberry Pi is Linux, but it's a unique flavor of Linux, specifically for the ARM-based Pi. Raspberry Pi Software Reference guides you through the boot process, including options for tweaking HDMI, memory, and other boot options. You'll learn the de ...# 1488456926# http://s.it-ebooks-api.info/6/raspberry_pi_system_software_reference.jpg# 9781484207970# # Raspberry Pi System Software Reference
Embedded platforms are interesting because they combine two fun fields. On one side, there is open source software, and on the other side, there is open source hardware. But a little further from that, we have electronics (AVR-microcontrollers), whic ...# 620563624# http://s.it-ebooks-api.info/14/getting_started_with_cubieboard.jpg# 9781783281572# Leverage the power of the ARM-based Cubieboard to create amazing projects# Getting Started with Cubieboard
Unity is a powerful cross-platform game creation system that includes a game engine and integrated development environment (IDE). AI programming in Unity is a key task for any game developer as it gives you the ability to make computer characters thi ...# 4010846267# http://s.it-ebooks-api.info/14/unity_ai_programming_essentials.jpg# 9781783553556# Use Unity3D, a popular game development ecosystem, to add realistic AI to your games quickly and effortlessly# Unity AI Programming Essentials
Most modern machines have dual-core processors. This means that the present-day computer has the ability to multitask. Using multiple cores means your applications can process data faster and be more responsive to users. However, to fully exploit thi ...# 4201967908# http://s.it-ebooks-api.info/14/c_multithreaded_and_parallel_programming.jpg# 9781849688321# Develop powerful C# applications to take advantage of today's multicore hardware# C# Multithreaded and Parallel Programming
Have you ever wondered how apps are made? Do you have a great idea for an app that you want to make reality? This book can teach you how to create apps for any Android device, even if you have never programmed before. With App Inventor, if you can im ...# 3566885166# http://s.it-ebooks-api.info/5/hello_app_inventor.jpg# 9781617291432# Android programming for kids and the rest of us# Hello App Inventor!
The BeagleBone is a microboard computer that offers all the possibilities of a larger PC in a miniaturized package. By learning embedded Linux for the BeagleBone, you can get started on the road to utilizing the power of the board to achieve its full ...# 2853018188# http://s.it-ebooks-api.info/14/learning_beaglebone.jpg# 9781783982905# Learn how to love and care for your BeagleBone and teach it tricks# Learning BeagleBone
